{
  "format": "tsuyomi-transfer",
  "version": 2,
  "createdAt": "2026-08-08T00:00:00Z",
  "library": [
    {
      "identity": {
        "sourceId": "org.tsuyomi.wenku8",
        "remoteBookId": "12345"
      },
      "title": "Fixture novel",
      "readLater": true,
      "updatedAt": "2026-08-08T00:00:00Z",
      "progress": {
        "chapterId": "67890",
        "characterOffset": 128,
        "chapterProgress": 0.2,
        "bookProgress": 0.1,
        "updatedAt": "2026-08-08T00:00:00Z"
      },
      "completedChapterIds": ["67889"]
    }
  ],
  "shelves": [],
  "preferences": {
    "reader": {
      "flow": "paged",
      "fontScale": 1.25,
      "lineHeight": 1.8,
      "theme": "warmGray",
      "horizontalMargin": 32,
      "paragraphSpacing": 16,
      "lockPortrait": true,
      "progressVisible": false,
      "immersive": true,
      "keepAwake": false,
      "volumePaging": false
    }
  }
}
